{
  "schema_version":"1.0.0","operation_id":"lifecycle.operation.demo","root_operation_id":"lifecycle.operation.demo","rollback_of_operation_id":null,"lifecycle_plan_id":"lifecycle.plan.demo","assembly_id":"assembly.demo","product_id":"product.demo","kind":"upgrade","version":3,"status":"completed","current_step":null,
  "source":{"manifest_id":"manifest.before","manifest_checksum":"sha256:aaaaaaaaaaaaaaaaaaaaaaaaaaaaaaaaaaaaaaaaaaaaaaaaaaaaaaaaaaaaaaaa","lock_id":"lock.before","lock_checksum":"sha256:bbbbbbbbbbbbbbbbbbbbbbbbbbbbbbbbbbbbbbbbbbbbbbbbbbbbbbbbbbbbbbbb","catalog_checksum":"sha256:cccccccccccccccccccccccccccccccccccccccccccccccccccccccccccccccc","target_snapshot_checksum":"sha256:dddddddddddddddddddddddddddddddddddddddddddddddddddddddddddddddd"},
  "target":{"manifest_id":"manifest.after","manifest_checksum":"sha256:eeeeeeeeeeeeeeeeeeeeeeeeeeeeeeeeeeeeeeeeeeeeeeeeeeeeeeeeeeeeeeee","lock_id":"lock.after","lock_checksum":"sha256:ffffffffffffffffffffffffffffffffffffffffffffffffffffffffffffffff","catalog_checksum":"sha256:1111111111111111111111111111111111111111111111111111111111111111","target_snapshot_checksum":"sha256:2222222222222222222222222222222222222222222222222222222222222222"},
  "recovery":{"retryable":false,"rollback_available":true,"cancel_allowed":false},"diagnostic_ids":[],"report_ids":["report.lifecycle"],"created_by":"admin.demo","created_at":"2026-07-16T08:00:00Z","updated_at":"2026-07-16T08:01:00Z","completed_at":"2026-07-16T08:01:00Z","operation_checksum":"sha256:3333333333333333333333333333333333333333333333333333333333333333"
}
